{
 "$schema": "https://json-schema.org/draft/2020-12/schema",
 "title": "FinReg-ES SourceContract v1.3 (fixtures/contracts/*.json)",
 "type": "object",
 "required": [
  "register_id",
  "contract_version",
  "g0_freeze",
  "authority",
  "register_name",
  "official_url",
  "legal_basis",
  "entity_classes_covered",
  "excluded_entity_classes",
  "activities_covered",
  "jurisdictions",
  "territorial_regimes",
  "update_cadence",
  "max_positive_staleness_days",
  "max_negative_staleness_days",
  "supports_source_as_of",
  "negative_evidence_capability",
  "identity_fields",
  "raw_format",
  "supports_bulk_snapshot",
  "coverage_rules",
  "notes",
  "verification"
 ],
 "properties": {
  "register_id": {
   "type": "string",
   "pattern": "^[A-Z0-9_]+$"
  },
  "contract_version": {
   "type": "string"
  },
  "g0_freeze": {
   "type": "string"
  },
  "authority": {
   "type": "string"
  },
  "register_name": {
   "type": "string"
  },
  "official_url": {
   "type": "string"
  },
  "legal_basis": {
   "type": "string"
  },
  "entity_classes_covered": {
   "type": "array",
   "items": {
    "type": "string"
   }
  },
  "excluded_entity_classes": {
   "type": "array",
   "items": {
    "type": "string"
   }
  },
  "activities_covered": {
   "type": "array",
   "items": {
    "type": "string"
   }
  },
  "jurisdictions": {
   "type": "array",
   "items": {
    "type": "string"
   }
  },
  "territorial_regimes": {
   "type": "array",
   "items": {
    "type": "string"
   }
  },
  "update_cadence": {
   "type": "string"
  },
  "max_positive_staleness_days": {
   "type": [
    "integer",
    "null"
   ]
  },
  "max_negative_staleness_days": {
   "type": [
    "integer",
    "null"
   ]
  },
  "supports_source_as_of": {
   "type": [
    "boolean",
    "null"
   ]
  },
  "negative_evidence_capability": {
   "type": "string",
   "enum": [
    "EXPLICIT_NEGATIVE_ONLY",
    "COMPLETE_ENUMERATION",
    "NO_NEGATIVE_INFERENCE",
    "NOT_APPLICABLE"
   ]
  },
  "identity_fields": {
   "type": "array",
   "items": {
    "type": "string"
   }
  },
  "raw_format": {
   "type": "string"
  },
  "supports_bulk_snapshot": {
   "type": [
    "boolean",
    "null"
   ]
  },
  "coverage_rules": {
   "type": "array",
   "items": {
    "type": "object",
    "required": [
     "rule_id",
     "scope",
     "entity_class",
     "activities",
     "jurisdictions",
     "territorial_bases",
     "valid_from",
     "valid_to",
     "note"
    ],
    "properties": {
     "rule_id": {
      "type": "string"
     },
     "scope": {
      "type": "string",
      "enum": [
       "IN",
       "OUT"
      ]
     },
     "entity_class": {
      "type": [
       "string",
       "null"
      ]
     },
     "activities": {
      "type": [
       "array",
       "null"
      ],
      "items": {
       "type": "string"
      }
     },
     "jurisdictions": {
      "type": [
       "array",
       "null"
      ],
      "items": {
       "type": "string"
      }
     },
     "territorial_bases": {
      "type": [
       "array",
       "null"
      ],
      "items": {
       "type": "string"
      }
     },
     "valid_from": {
      "type": [
       "string",
       "null"
      ]
     },
     "valid_to": {
      "type": [
       "string",
       "null"
      ]
     },
     "note": {
      "type": [
       "string",
       "null"
      ]
     }
    },
    "additionalProperties": false
   }
  },
  "notes": {
   "type": "array",
   "items": {
    "type": "string"
   }
  },
  "verification": {
   "type": "object",
   "additionalProperties": {
    "type": "object",
    "required": [
     "status",
     "source_url",
     "note"
    ],
    "properties": {
     "status": {
      "type": "string",
      "enum": [
       "VERIFIED",
       "PENDING",
       "PROPOSED"
      ]
     },
     "source_url": {
      "type": [
       "string",
       "null"
      ]
     },
     "note": {
      "type": [
       "string",
       "null"
      ]
     }
    },
    "additionalProperties": false
   }
  },
  "capability_vector_completeness": {
   "type": "object",
   "additionalProperties": false,
   "required": [
    "property",
    "applies_when",
    "slices",
    "note"
   ],
   "properties": {
    "property": {
     "type": "string",
     "enum": [
      "CAPABILITY_VECTOR_COMPLETE_WHEN_RECORD_PRESENT"
     ]
    },
    "note": {
     "type": "string"
    },
    "applies_when": {
     "type": "object"
    },
    "slices": {
     "type": "array",
     "items": {
      "type": "object",
      "required": [
       "slice_id",
       "field",
       "universe"
      ],
      "properties": {
       "slice_id": {
        "type": "string"
       },
       "entity_classes": {
        "type": [
         "array",
         "null"
        ]
       },
       "territorial_bases": {
        "type": [
         "array",
         "null"
        ]
       },
       "field": {
        "type": "string"
       },
       "universe": {
        "type": "string"
       },
       "note": {
        "type": "string"
       }
      }
     }
    }
   }
  }
 },
 "additionalProperties": false,
 "description": "v1.3: G1-E/E4 — capability_vector_completeness opcional (completitud scoped del vector de capacidades, distinta de la completitud poblacional negative_evidence_capability). Contratos v1 siguen siendo validos."
}
