{
 "register_id": "EBA_PSD2_REGISTER",
 "contract_version": "1.2.0",
 "g0_freeze": "G0.1",
 "authority": "European Banking Authority (EBA)",
 "register_name": "EBA Register of Payment and Electronic Money Institutions (PSD2)",
 "official_url": "https://webgate.ec.europa.eu/psd2register/",
 "legal_basis": "Reglamento (UE) 2019/518, articulos 16-18 (modifica la PSD2, Directiva (UE) 2015/2365)",
 "entity_classes_covered": [
  "PAYMENT_INSTITUTION",
  "E_MONEY_INSTITUTION",
  "PSP_AGENT",
  "ACCOUNT_INFORMATION_SERVICE_PROVIDER",
  "EXEMPTED_PAYMENT_INSTITUTION",
  "EXEMPTED_E_MONEY_INSTITUTION"
 ],
 "excluded_entity_classes": [
  "CREDIT_INSTITUTION",
  "INVESTMENT_FIRM_ESI",
  "FINANCIAL_ADVISER_EAF",
  "FUND_MANAGER_SGIIC",
  "CASP"
 ],
 "activities_covered": [
  "PAYMENT_SERVICES",
  "E_MONEY_ISSUANCE",
  "ACCOUNT_INFORMATION_SERVICES",
  "PAYMENT_ACCOUNT_CASH_PLACEMENT",
  "PAYMENT_ACCOUNT_CASH_WITHDRAWAL",
  "PAYMENT_DIRECT_DEBIT_EXECUTION",
  "PAYMENT_CARD_TRANSACTION_EXECUTION",
  "PAYMENT_CREDIT_TRANSFER_EXECUTION",
  "PAYMENT_DIRECT_DEBIT_EXECUTION_CREDIT_LINE",
  "PAYMENT_CARD_TRANSACTION_EXECUTION_CREDIT_LINE",
  "PAYMENT_CREDIT_TRANSFER_EXECUTION_CREDIT_LINE",
  "PAYMENT_INSTRUMENT_ISSUING",
  "PAYMENT_TRANSACTION_ACQUIRING",
  "MONEY_REMITTANCE",
  "PAYMENT_INITIATION_SERVICES"
 ],
 "jurisdictions": [
  "EEA"
 ],
 "territorial_regimes": [
  "DOMESTIC",
  "BRANCH",
  "FREEDOM_TO_PROVIDE_SERVICES"
 ],
 "update_cadence": "UNKNOWN (H4: verificar cadencia de feeds NCA)",
 "max_positive_staleness_days": 45,
 "max_negative_staleness_days": 30,
 "supports_source_as_of": null,
 "negative_evidence_capability": "EXPLICIT_NEGATIVE_ONLY",
 "identity_fields": [
  "legal_name",
  "LEI",
  "HOME_STATE_ID"
 ],
 "raw_format": "HTML + (H4: verificar descarga masiva CSV/XML)",
 "supports_bulk_snapshot": null,
 "coverage_rules": [
  {
   "rule_id": "eba-psd2-in-eea",
   "scope": "IN",
   "entity_class": null,
   "activities": null,
   "jurisdictions": null,
   "territorial_bases": [
    "DOMESTIC",
    "BRANCH",
    "FREEDOM_TO_PROVIDE_SERVICES"
   ],
   "valid_from": null,
   "valid_to": null,
   "note": "PI/EMI (y agentes) del EEE, con pasaporte por Estado miembro y modalidad (sucursal/FPS)"
  },
  {
   "rule_id": "eba-psd2-out-credit-institutions",
   "scope": "OUT",
   "entity_class": "CREDIT_INSTITUTION",
   "activities": null,
   "jurisdictions": null,
   "territorial_bases": null,
   "valid_from": null,
   "valid_to": null,
   "note": "W2: el registro EXCLUYE entidades de credito (marco unico CRD). Que un banco no aparezca JAMAS puede demostrar ausencia de servicios de pago"
  },
  {
   "rule_id": "eba-psd2-out-crypto",
   "scope": "OUT",
   "entity_class": null,
   "activities": [
    "CRYPTO_ASSET_SERVICES"
   ],
   "jurisdictions": null,
   "territorial_bases": null,
   "valid_from": null,
   "valid_to": null,
   "note": "El registro PSD2 no cubre servicios sobre criptoactivos"
  }
 ],
 "notes": [
  "H4: verificar si incluye AISP registrados sin autorizacion plena y si publica LEI por entidad.",
  "La exclusión de las entidades de crédito es el ejemplo canónico de negative_evidence_capability acotado por coverage(): la ausencia de un banco en este registro NO es evidencia de nada.",
  "G1-A (contract 1.1.0): resolucion H9 — el registro incluye AISP/EPI/EEMI via REGISTRATION (Annex 2019/410 Tables 2/3/5) y ENL/EXC; H4 parcialmente cerrado. ENT_AUT es secuencia alternante auth/withdrawal (spec oficial EBA).",
  "1.2.0 (G1-E/E4): actividades PSD2 Annex I granulares anadidas al ambito; completitud scoped del vector Services{ES} declarada como CAPABILITY_VECTOR_COMPLETE_WHEN_RECORD_PRESENT. El contrato poblacional sigue EXPLICIT_NEGATIVE_ONLY: la ausencia de una entidad del registro NUNCA es negativa."
 ],
 "verification": {
  "legal_basis": {
   "status": "VERIFIED",
   "source_url": "https://eur-lex.europa.eu/legal-content/EN/TXT/?uri=CELEX%3A32019R0518",
   "note": "Reg. (UE) 2019/518 arts. 16-18: mandato del registro EBA"
  },
  "excluded_entity_classes": {
   "status": "VERIFIED",
   "source_url": "https://webgate.ec.europa.eu/psd2register/",
   "note": "El registro declara que las entidades de credito no se incluyen; re-verificar pagina de documentacion en G0.5"
  },
  "entity_classes_covered": {
   "status": "PENDING",
   "source_url": null,
   "note": "H4: verificar inclusion de AISP registrados"
  },
  "identity_fields": {
   "status": "PENDING",
   "source_url": null,
   "note": "H4: verificar campo LEI"
  },
  "update_cadence": {
   "status": "PENDING",
   "source_url": null,
   "note": "H4"
  },
  "supports_bulk_snapshot": {
   "status": "PENDING",
   "source_url": null,
   "note": "H4/C3"
  },
  "max_positive_staleness_days": {
   "status": "PROPOSED",
   "source_url": null,
   "note": "Politica propia"
  },
  "max_negative_staleness_days": {
   "status": "PROPOSED",
   "source_url": null,
   "note": "Politica propia"
  },
  "negative_evidence_capability": {
   "status": "PROPOSED",
   "source_url": null,
   "note": "EXPLICIT_NEGATIVE_ONLY: la completitud de los feeds NCA no esta verificada"
  }
 },
 "capability_vector_completeness": {
  "property": "CAPABILITY_VECTOR_COMPLETE_WHEN_RECORD_PRESENT",
  "note": "G1-E (E3/E4): la especificacion oficial EBA congelada define Services como la lista completa de servicios Annex I por pais para un registro presente. Es una propiedad scoped del vector de capacidades, DISTINTA de la completitud poblacional: la ausencia de una entidad entera del registro sigue sin ser evidencia negativa (negative_evidence_capability=EXPLICIT_NEGATIVE_ONLY). Validez temporal: el vector solo es evidencia del snapshot actual; sin fechas territoriales historicas, effective_from=EVIDENCE_AS_OF.",
  "applies_when": {
   "record_present": true,
   "identity": "EXACT",
   "route": "KNOWN",
   "activity": "ATOMIC",
   "current_snapshot": true,
   "conflicting_evidence": false
  },
  "slices": [
   {
    "slice_id": "eba-fps-services-vector",
    "entity_classes": [
     "PAYMENT_INSTITUTION",
     "E_MONEY_INSTITUTION"
    ],
    "territorial_bases": [
     "FREEDOM_TO_PROVIDE_SERVICES"
    ],
    "field": "Services{ES}",
    "universe": "EBA_PSD2_SERVICE_CODES",
    "note": "Ausencia de un codigo atomico en Services{ES} de un registro PI/EMI presente y activo"
   },
   {
    "slice_id": "eba-branch-services-vector",
    "entity_classes": [
     "PSD_BRANCH"
    ],
    "territorial_bases": [
     "BRANCH"
    ],
    "field": "Services{ES}",
    "universe": "EBA_PSD2_SERVICE_CODES",
    "note": "Sucursal EBA (PSD_BR) presente con parent activo: mismo contrato de vector"
   },
   {
    "slice_id": "eba-aisp-services-vector",
    "entity_classes": [
     "ACCOUNT_INFORMATION_SERVICE_PROVIDER"
    ],
    "territorial_bases": [
     "DOMESTIC"
    ],
    "field": "Services{ES}",
    "universe": "EBA_PSD2_SERVICE_CODES",
    "note": "Un AISP registrado declara el universo de servicios Annex I que presta; su vector es completo por construccion"
   }
  ]
 }
}
