{
 "activities_covered": [
  "PAYMENT_SERVICES",
  "E_MONEY_ISSUANCE",
  "PAYMENT_ACCOUNT_CASH_PLACEMENT",
  "PAYMENT_ACCOUNT_CASH_WITHDRAWAL",
  "PAYMENT_DIRECT_DEBIT_EXECUTION",
  "PAYMENT_CARD_TRANSACTION_EXECUTION",
  "PAYMENT_CREDIT_TRANSFER_EXECUTION",
  "PAYMENT_DIRECT_DEBIT_EXECUTION_CREDIT_LINE",
  "PAYMENT_CARD_TRANSACTION_EXECUTION_CREDIT_LINE",
  "PAYMENT_CREDIT_TRANSFER_EXECUTION_CREDIT_LINE",
  "PAYMENT_INSTRUMENT_ISSUING",
  "PAYMENT_TRANSACTION_ACQUIRING",
  "MONEY_REMITTANCE",
  "PAYMENT_INITIATION_SERVICES",
  "ACCOUNT_INFORMATION_SERVICES"
 ],
 "authority": "Banco de Espana",
 "contract_version": "1.1.0",
 "coverage_rules": [
  {
   "activities": null,
   "entity_class": null,
   "jurisdictions": [
    "ES"
   ],
   "note": "Sucursales ES de EP/EDE comunitarias inscritas: evidencia del trigger territorial de establecimiento (G1-D)",
   "rule_id": "bde-psp-in-branch",
   "scope": "IN",
   "territorial_bases": [
    "BRANCH"
   ],
   "valid_from": null,
   "valid_to": null
  },
  {
   "activities": null,
   "entity_class": null,
   "jurisdictions": null,
   "note": "La LPS no se inscribe en este registro: su ausencia nunca es evidencia negativa de la ruta FPS",
   "rule_id": "bde-psp-out-fps",
   "scope": "OUT",
   "territorial_bases": [
    "FREEDOM_TO_PROVIDE_SERVICES"
   ],
   "valid_from": null,
   "valid_to": null
  },
  {
   "rule_id": "bde-psp-in-domestic-entities",
   "scope": "IN",
   "entity_class": null,
   "activities": null,
   "jurisdictions": [
    "ES"
   ],
   "territorial_bases": [
    "DOMESTIC"
   ],
   "valid_from": null,
   "valid_to": null,
   "note": "G1-E: la hoja incluye EP/EDE domesticas (TEEP/EDE espanolas) y PISP — entidad + fecha alta/baja + motivo"
  },
  {
   "rule_id": "bde-psp-out-agents",
   "scope": "OUT",
   "entity_class": "PSP_AGENT",
   "activities": null,
   "jurisdictions": null,
   "territorial_bases": null,
   "valid_from": null,
   "valid_to": null,
   "note": "Agentes: via delegada del principal, nunca entitlement propio — fuera de inferencia negativa independiente"
  }
 ],
 "entity_classes_covered": [
  "PAYMENT_INSTITUTION",
  "E_MONEY_INSTITUTION",
  "PSP_AGENT",
  "ACCOUNT_INFORMATION_SERVICE_PROVIDER"
 ],
 "excluded_entity_classes": [
  "CASP",
  "CREDIT_INSTITUTION"
 ],
 "g0_freeze": "G1-D",
 "identity_fields": [
  "legal_name",
  "codigo_be",
  "nombre_matriz"
 ],
 "jurisdictions": [
  "ES"
 ],
 "legal_basis": "PSD2 (UE) 2015/2366 art. 28: para sucursales/agentes la actividad solo puede comenzar tras la inscripcion en el registro del Estado de acogida; el BdE publica el registro especial de servicios de pago (alta/baja por sucursal)",
 "max_negative_staleness_days": 45,
 "max_positive_staleness_days": 90,
 "negative_evidence_capability": "NO_NEGATIVE_INFERENCE",
 "notes": [
  "G1-D: fecha_alta (FECHA ALTA) es la fecha territorial juridica de la ruta sucursal; la hoja expone FECHA BAJA + MOTIVO BAJA — vacia = inscripcion vigente.",
  "NO_NEGATIVE_INFERENCE: ausencia en el registro no permite negativo; la rama sin inscripcion demostrada produce abstencion (REQUIRED_FIELD_MISSING), nunca NOT_ENTITLED.",
  "G1-D-F04: corregida la nota 1.0.0 que afirmaba que la hoja no expone fecha de baja; la auditoria B1 y el propio xlsx documentan FECHA BAJA + MOTIVO BAJA.",
  "1.1.0 (G1-E/E4): ambito ampliado a entidades domesticas (EP/EDE espanolas, PISP) y actividades Annex I granulares; slices de enumeracion completa declarados scoped (CAPABILITY_VECTOR_COMPLETE_WHEN_RECORD_PRESENT). NO_NEGATIVE_INFERENCE global y LPS/agentes OUT se mantienen."
 ],
 "official_url": "https://www.bde.es/f/webbe/SGE/regis/ficheros/es/Registro_ServicioPagos.xlsx",
 "raw_format": "XLSX (descarga oficial; columnas CODIGO BE / TIPO ENTIDAD / FECHA ALTA / FECHA BAJA / MOTIVO BAJA / PAIS DE ORIGEN)",
 "register_id": "BDE_REGISTRO_SERVICIOS_PAGO",
 "register_name": "Registro especial del Banco de Espana de entidades de servicios de pago (sucursales y agentes de EP/EDE extranjeras comunitarias)",
 "supports_bulk_snapshot": true,
 "supports_source_as_of": true,
 "territorial_regimes": [
  "BRANCH",
  "DOMESTIC"
 ],
 "update_cadence": "UNKNOWN (xlsx publicado con fecha de datos declarada)",
 "verification": {
  "authority": {
   "note": "descarga oficial BdE verificada en G1-D (snapshot congelado, sha256 en manifest)",
   "source_url": "https://www.bde.es/f/webbe/SGE/regis/ficheros/es/Registro_ServicioPagos.xlsx",
   "status": "VERIFIED"
  },
  "legal_basis": {
   "note": "PSD2 art. 28 verificado contra DOUE L 337 congelado (doue-psd2-2015-2366-es.pdf)",
   "source_url": "https://eur-lex.europa.eu/eli/dir/2015/2366/oj",
   "status": "VERIFIED"
  },
  "max_negative_staleness_days": {
   "note": "Politica propia",
   "source_url": null,
   "status": "PROPOSED"
  },
  "max_positive_staleness_days": {
   "note": "Politica propia",
   "source_url": null,
   "status": "PROPOSED"
  },
  "negative_evidence_capability": {
   "note": "Conservador: sin completitud verificada no hay inferencia negativa",
   "source_url": null,
   "status": "PROPOSED"
  },
  "supports_source_as_of": {
   "note": "el xlsx declara fecha de datos (source_as_of 2026-09-10 en el snapshot congelado)",
   "source_url": "https://www.bde.es/f/webbe/SGE/regis/ficheros/es/Registro_ServicioPagos.xlsx",
   "status": "VERIFIED"
  }
 },
 "capability_vector_completeness": {
  "property": "CAPABILITY_VECTOR_COMPLETE_WHEN_RECORD_PRESENT",
  "note": "G1-E (E4): la hoja ACTIVIDADES del workbook congelado enumera, para cada CODIGO BE presente y en alta, sus servicios Annex I. Es completitud scoped del slice domestico — no poblacional: la ausencia de una entidad del registro sigue sin ser negativa (NO_NEGATIVE_INFERENCE global). La LPS de PI/EMI extranjeras queda OUT: no se inscribe en este registro.",
  "applies_when": {
   "record_present": true,
   "identity": "EXACT",
   "route": "KNOWN",
   "activity": "ATOMIC",
   "current_snapshot": true,
   "conflicting_evidence": false
  },
  "slices": [
   {
    "slice_id": "bde-domestic-pi-activities",
    "entity_classes": [
     "PAYMENT_INSTITUTION"
    ],
    "territorial_bases": [
     "DOMESTIC"
    ],
    "field": "ACTIVIDADES",
    "universe": "BDE_PSD2_SERVICE_CODES",
    "note": "EP domesticas (TEEP): enumeracion completa de servicios autorizados mientras la fila esta en alta"
   },
   {
    "slice_id": "bde-domestic-emi-activities",
    "entity_classes": [
     "E_MONEY_INSTITUTION"
    ],
    "territorial_bases": [
     "DOMESTIC"
    ],
    "field": "ACTIVIDADES",
    "universe": "BDE_PSD2_SERVICE_CODES",
    "note": "EDE domesticas: incluye emision de moneda electronica (codigos A/B/C)"
   },
   {
    "slice_id": "bde-aisp-activities",
    "entity_classes": [
     "ACCOUNT_INFORMATION_SERVICE_PROVIDER"
    ],
    "territorial_bases": [
     "DOMESTIC"
    ],
    "field": "ACTIVIDADES",
    "universe": "BDE_PSD2_SERVICE_CODES",
    "note": "PISP inscritos: servicio declarado completo por construccion del registro"
   }
  ]
 }
}
